Notional Machines for Inclusive Learning,D. Wilson; S. Sarwar; N. Najjar,"College of Computing and Informatics, University of North Carolina at Charlotte; College of Computing and Informatics, University of North Carolina at Charlotte; College of Computing and Informatics, University of North Carolina at Charlotte",2024 IEEE Frontiers in Education Conference (FIE),26 Feb 2025,2024,,,1,9,"Understanding computing concepts is one of the foundational elements of computational thinking, which helps students formulate logic and algorithms for effectively developing and designing codes. However, novice learners often struggle to understand basic computing concepts, such as variables, loops, arrays, conditionals, and functions. This is often caused by the invisibility of the computing mechanism and the complexity of language syntax and conventions. Moreover, challenges in learning computing concepts can be compounded for learners with atypical conditions (e.g. visual, cognitive, and learning impairment, attention deficit, and neurodivergence). To tackle this, teachers of typical ability learners frequently use notional machines (NMs) - simplified representations (e.g. diagrams, flow charts, and analogies) created to assist novice programmers in understanding abstract concepts, program execution, and dynamics. In addition, traditional learning activities may need assistive learning interventions (ALIs) and learner-oriented practices like physical tactile models, computing artifacts, and interactive learning tools. NM approaches tend to focus on the explanation of concepts from instructor to learner, while ALIs tend to focus on learner support in activities. Both methods can provide advantages for learning, and we expect that a combined approach would provide even greater synergy for all learners. However, little consideration has been given to how NM and ALI approaches could be effectively combined. This research investigates how NM and ALI can be effectively brought together more holistically as an inclusive pedagogical tool - notional machines for inclusive learning (NMIL). In this full paper, we develop the conceptualization of NMIL, grounded in previous NM and ALI research. We also propose a structured method for creating NMIL. Finally, we also develop a physical NMIL model, based on the structured NMIL creation method, to teach lists in Python, as part of an introductory computer science course.",2377-634X,979-8-3503-5150-7,10.1109/FIE61694.2024.10892884,,https://ieeexplore.ieee.org/stamp/stamp.jsp?arnumber=10892884,Computational thinking;Pedagogy;Instructional design,Computer science;Visualization;Codes;Computational modeling;Syntactics;Complexity theory;Logic;Python,,,,56.0,IEEE,26 Feb 2025,,,IEEE,IEEE Conferences,6,7
No patterns in pattern recognition: A systematic literature review,A. Dasgupta; S. Purzer,"School of Engineering Education, Purdue University, West Lafayette, U.S.A.; School of Engineering Education, Purdue University, West Lafayette, Indiana",2016 IEEE Frontiers in Education Conference (FIE),1 Dec 2016,2016,,,1,3,"Pattern recognition is one of the fundamental competencies associated with computational thinking and STEM education. Although much has been written to define computational thinking (CT), we argue that CT is a multi-faceted construct and specific aspects of CT (such as pattern recognition) should be examined. The purpose of this study is to conduct a systematic review of literature on pattern recognition to define pattern recognition as an aspect of computational thinking. The synthesis included the Engineering Village database (Compendex and INSPEC). We searched peer reviewed articles and the keywords, pattern recognition, pattern generalization and education. The initial search resulted in 208 articles. The screening of abstracts more closely resulted in 17 relevant articles, which were then read in detail by two researchers. The review of this pool resulted in two relevant articles, one with a focus on mathematics education and the other one in the context of medical education. Surprisingly there were no articles that examined pattern recognition as part of engineering or computer education. Further research examining specific aspects of CT is necessary.",,978-1-5090-1790-4,10.1109/FIE.2016.7757676,,https://ieeexplore.ieee.org/stamp/stamp.jsp?arnumber=7757676,pattern recognition;pattern generalization;computer education;computing;computational thinking;STEM,Pattern recognition;Education;Systematics;Databases;Computers;Mathematics;Standards,,3.0,,9.0,IEEE,1 Dec 2016,,,IEEE,IEEE Conferences,6,9
Analysis on the incorporation of technologies with a pedagogical perspective,F. J. Díaz; N. Soledad Gómez; M. Catino,"LINTI (Laboratorio de Investigación en Nuevas Tecnologías Informáticas), Facultad de Informática, Universidad Nacional de La Plata, La Plata, Argentina; LINTI (Laboratorio de Investigación en Nuevas Tecnologías Informáticas), Facultad de Informática, Universidad Nacional de La Plata, La Plata, Argentina; IIES (Instituto de Investigación de Educación Superior), Universidad Nacional de La Plata, La Plata, Argentina",2020 39th International Conference of the Chilean Computer Science Society (SCCC),9 Dec 2020,2020,,,1,8,"This work is the result of an investigation carried out within the framework of a research grant. The work experience that this team carried out was aimed at describing and systematizing the configuration of computational thinking, its incidence and validity in the educational field from the analysis of public policies, from an interdisciplinary approach. The experience carried out was developed based on a bibliographic and documentary analysis work, which allowed recovering the concept of computational thinking to analyze it in conjunction with the development of critical pedagogical practice and the concept of competences. Here an analysis of some of the current debates presented by computational thinking and its teaching is presented in order to promote a line of dialogue and problematization between what was done, is done and is projected on this subject.",1522-4902,978-1-7281-8328-2,10.1109/SCCC51225.2020.9281177,,https://ieeexplore.ieee.org/stamp/stamp.jsp?arnumber=9281177,Computational Thinking;education;communication,Computer science;Education;Public policy,,,,0.0,IEEE,9 Dec 2020,,,IEEE,IEEE Conferences,6,8
Discovering Programming Talent and Improving Learning Motivation with CodeCombat in K-12 Education,W. C. Choi; I. C. Choi,"Department of Computer Science, Illinois Institute of Technology, US; School of Education, City University of Macau, Macao SAR, China",2024 IEEE World Engineering Education Conference (EDUNINE),24 Apr 2024,2024,,,1,6,"Nurturing programming talent early is crucial in today's digital world, especially in K-12 education, underscored by the rise of programming competitions for younger students. However, with limited research in programming talent search, discovering programming talent in primary schools posed a significant challenge. Traditionally, various test-based talent search tools have been utilized for programming talent identification, including the Computer Talent Search Test (CTST) and the Beginners Computational Thinking Test (BCTt). Game-based platforms like CodeCombat offer an engaging alternative to overcome this challenge. CodeCombat integrates game-based learning with programming education, allowing students to apply their computational thinking skills in an enjoyable context for learning Python. The study revealed a significant correlation between CodeCombat, CTST, and BCTt outcomes. This highlighted that CodeCombat emerged as a valuable platform for talent search, aligning seamlessly with the objectives of the test-based tools and suggesting its effectiveness in boosting programming learning motivation in primary school.",,979-8-3503-4872-9,10.1109/EDUNINE60625.2024.10500458,,https://ieeexplore.ieee.org/stamp/stamp.jsp?arnumber=10500458,CodeCombat;K-12 programming education;Programming talent search;Learning motivation,Correlation;Search problems;Boosting;Engineering education;Programming profession;Python,,,,22.0,IEEE,24 Apr 2024,,,IEEE,IEEE Conferences,6,7
Possible connecting areas of education and intelligent systems,R. Ősz; J. Fodor,"Óbuda University, Hungary; Óbuda University, Hungary",2013 IEEE 9th International Conference on Computational Cybernetics (ICCC),3 Oct 2013,2013,,,51,56,"As more and more developed ICT devices appear more and more frequently, these become natural attributes of life for the contemporary “digital generation”. For the generation which grew up in the e-world, it was natural that their everyday activities were tied to the possibilities offered by the networks. These challenges could not leave the pedagogical science cold either. It tried to comply with the generation challenges from the very beginning. It tried to “borrow” those technical devices, theories and methods, which were already applied successfully by other fields of science, adjusting its own learning methods, teaching and learning models and learning environments to them. In our article, we try to draw a parallel between the system of engineering and pedagogy. Furthermore, we would like to map the new trends of pedagogy, which are possible on the basis of the logics of engineering.",,978-1-4799-0063-3,10.1109/ICCCyb.2013.6617560,,https://ieeexplore.ieee.org/stamp/stamp.jsp?arnumber=6617560,education;intelligent systems;fuzzy logic,Materials;Education;Fuzzy logic;Uncertainty;Fuzzy sets;Intelligent systems,,2.0,,6.0,IEEE,3 Oct 2013,,,IEEE,IEEE Conferences,6,4
Exploration and practice of online and offline mixed teaching mode based on PBL in basic computer courses,H. Liu; S. Li; Y. Xiao,"College of Computer Science and Cyber Security, Chengdu University of Technology, Chengdu, Sichuan, China; College of Computer Science and Cyber Security, Chengdu University of Technology, Chengdu, Sichuan, China; College of Computer Science and Cyber Security, Chengdu University of Technology, Chengdu, Sichuan, China","2021 International Symposium on Advances in Informatics, Electronics and Education (ISAIEE)",9 Mar 2022,2021,,,101,105,"The epidemic situation in 2020 has promoted the development of online education. After the epidemic, in order to make full use of various online education resources, we began to explore online and offline hybrid teaching. In order to improve students' learning interest and enthusiasm, PBL is combined with online and offline teaching mode, and the implementation of teaching mode and teaching effect are introduced.",,978-1-6654-7874-8,10.1109/ISAIEE55071.2021.00032,,https://ieeexplore.ieee.org/stamp/stamp.jsp?arnumber=9726960,PBL;Online and Offline Hybrid Teaching;Computational Thinking,Epidemics;Computer aided instruction;Electronic learning;Distance learning;Education;Transforms;Market research,,,,10.0,IEEE,9 Mar 2022,,,IEEE,IEEE Conferences,6,5
Employing narratives to trigger interest in computational activities with inner-city girls,S. Erete; N. Pinkard; C. K. Martin; J. Sandherr,"College of Computing and Digital Media, DePaul University, Chicago, IL, USA; College of Computing and Digital Media, DePaul University, Chicago, IL, USA; Digital Youth Network, DePaul University, Chicago, IL, USA; Digital Youth Network, DePaul University, Chicago, IL, USA","2015 Research in Equity and Sustained Participation in Engineering, Computing, and Technology (RESPECT)",12 Oct 2015,2015,,,1,1,"There has been a well-documented and persistent drop in the number of women in computer science and engineering courses [1]. Young peoples' decisions about participation often start early and have been linked to particular experiences [2]. For some young people, these experiences are less than encouraging. In the US, high school computer science courses are overwhelmingly male dominated [3]. Schools serving minority students and those from lower socioeconomic backgrounds often struggle to even offer such classes [4]. Even when opportunities exist, many girls and underrepresented populations face barriers such as negative stereotypes and dearth of role models and community [5]. The Digital Youth Divas program was created to address these issues through intentional design. The program is developed to trigger situational interest [6] in girls through a combination of community, project-based instruction, on- and offline learning spaces, and narrative stories. Triggered situational interest is critical as an opening to move on to subsequent phases that are more independent of environmental factors. Understanding potential effective triggers for girls, minorities, and youth from lower socioeconomic backgrounds is critical to engaging such populations in STEM learning. (1) Community: Middle school girls interested in fashion and design are recruited, especially from areas that have traditionally been underserved. Adult mentors who are not engineers, but share cultural connections with the girls and have gone through curriculum and pedagogical training, attend to specific practices of encouraging, helping to troubleshoot, and developing community. (2) Project-based instruction: The program combines principles of fashion, design, and dance with the power and possibilities of electronic circuits and programming to develop interactive e-fashion projects and virtual programmed choreographies. Scaffolded challenges work through stages of design and computational thinking, including paper prototyping, implementation, feedback, and revision. (3) Integrated on and offline learning spaces: Girls work through projects in a shared physical space using supplied materials. An online system, iRemix, is the mechanism for independent work and leveling up. (4) Interactive narrative stories: Narratives can provide context that helps relate abstract concepts to real-world issues [7], increase motivation and positively contribute to girls' science identity [8], and provide focus for design by communicating tasks, specifically when readers can identify with the stories [9]. Compelling stories conveyed in text and multimedia (video, audio, images) is employed to engage middle school girls in activities involving computational thinking. The stories center on a group of middle school girls involved in the Digital Youth Divas program, and combines aspects of contemporary young adult fiction (mystery, social and emotional issues) with content, topics, and project work from the e-textiles and programming curricula. The interactive narratives unfold through the iRemix platform: girls launch narratives and at intervals are prompted to engage in project-based work. The girls solve challenges by submitting work online, and receive and respond to messages from characters. Our early exploratory research suggested that narratives prompted discussions of identity, and contributed to participant interest in the program content and motivation to engage in project work.",,978-1-5090-0151-4,10.1109/RESPECT.2015.7296518,,https://ieeexplore.ieee.org/stamp/stamp.jsp?arnumber=7296518,,Physics;Statistics;Sociology;Computational modeling;User experience;Training;Textiles,,6.0,,,IEEE,12 Oct 2015,,,IEEE,IEEE Conferences,6,8
Use of ICT in engineering education: A survey report,L. Dhandabani; R. Sukumaran,"Adithya Institute of Technology, Coimbatore, Tamil Nadu, IN; Indian Institute of Technology Madras, Chennai, Tamil Nadu, IN",2014 IEEE International Conference on Computational Intelligence and Computing Research,7 Sep 2015,2014,,,1,5,"Amongst the various open source educational software, the Modular Object Oriented Developmental Learning Environment (MOODLE) seems to be the most user friendly having numerous features. This paper aims at investigating the usefulness of digital technologies imparted into a blended learning model for engineering education. The role of Information and Communication Technology (ICT) plays a wider role in teaching-learning activities like, content creation, administrative, formative-summative assessments, student's performance tracking, trainings, knowledge management and knowledge organization. In addition, the technical features of ICT allow us to customize to meet the demands of an institution. Considering the recent major shifts in the learning paradigm, these innovations were deployed in an ongoing, real time basis in our educational campus. Technology based virtual learning approach was aimed at stimulating students' interest in learning engineering curriculum; consequently its effectiveness was statistically evaluated. Finally, this research report is aimed at summarizing the ways in which ICT is used, and how it creates new learning opportunities both online and off line.",,978-1-4799-3975-6,10.1109/ICCIC.2014.7238362,,https://ieeexplore.ieee.org/stamp/stamp.jsp?arnumber=7238362,Information and Communication Technology (ICT);Learning Management System (LMS);Content Management System (CMS);Educational Practices;e-Survey,,,5.0,,,IEEE,7 Sep 2015,,,IEEE,IEEE Conferences,6,8
Team-based learning course design and assessment in computer engineering,M. Awatramani; D. Rover,"Iowa State University, Ames, IA, US; Department of Electrical and Computer Engineering, Iowa State University, Ames, IA, USA",2015 IEEE Frontiers in Education Conference (FIE),7 Dec 2015,2015,,,1,9,"The flipped classroom model is gaining increasing attention in higher education, including engineering education. There are various types of models and contexts in which they are applied. Generalized research on the effectiveness of the flipped classroom is emerging, and results have been mixed. One such model is team-based learning (TBL) as originally developed by Larry Michaelsen in the late 1970s. TBL is a structured way to implement a flipped classroom approach, and has been shown to be successful in achieving deeper learning among the students. In this paper, we discuss our experience using the TBL methodology in a graduate computer engineering course on system level design of embedded systems. Specifically, we describe the course design, instructor experience adapting TBL for use in the course, including implementing an asynchronous online TBL process, and instructor reflections and student feedback on what worked well and what did not. We analyze the course content using the Florida Taxonomy of Cognitive Behavior, and assess the effectiveness of our implementation in achieving deeper learning. Additionally, we report on student perception of the new course structure and their experience using TBL.",,978-1-4799-8454-1,10.1109/FIE.2015.7344227,,https://ieeexplore.ieee.org/stamp/stamp.jsp?arnumber=7344227,engineering education;team-based learning;online learning;asynchronous teaming;embedded systems,Education;Embedded systems;Computational modeling;Online services;Computers;System-level design,,6.0,,38.0,IEEE,7 Dec 2015,,,IEEE,IEEE Conferences,6,8
Research on Interactive Simulation Software Is Applied to Foreign Language Teaching Based on Delphi,W. Wei,"School of Foreign Languages, Northeast Dianli University, Jilin City, China",2014 International Conference on Computational Intelligence and Communication Networks,26 Mar 2015,2014,,,1113,1116,"This paper describes the process of design and implementation of multimedia foreign language teaching simulation software is an open system, the simulation of the software system can realize multi computer courses in foreign language, practice. Course selection, foreign language selection method using menu, each foreign language simulation with animation, pictures and text forms, which uses the material is in the form of documents, and is easy to realize dynamic adding, modifying, lookup and update.",,978-1-4799-6929-6,10.1109/CICN.2014.233,,https://ieeexplore.ieee.org/stamp/stamp.jsp?arnumber=7065653,Foreign language teaching;practice;simulation;Delphi,Education;Mobile communication;Mobile computing;Cloud computing;Computational modeling;Multimedia communication,,,,11.0,IEEE,26 Mar 2015,,,IEEE,IEEE Conferences,6,3
Co-Designing Machine Learning Apps in K–12 With Primary School Children,T. Toivonen; I. Jormanainen; J. Kahila; M. Tedre; T. Valtonen; H. Vartiainen,"School of Computing, University of Eastern Finland, Joensuu, Finland; School of Computing, University of Eastern Finland, Joensuu, Finland; School of Applied Educational Science and Teacher Education, University of Eastern Finland, Joensuu, Finland; School of Computing, University of Eastern Finland, Joensuu, Finland; School of Applied Educational Science and Teacher Education, University of Eastern Finland, Joensuu, Finland; School of Applied Educational Science and Teacher Education, University of Eastern Finland, Joensuu, Finland",2020 IEEE 20th International Conference on Advanced Learning Technologies (ICALT),4 Aug 2020,2020,,,308,310,"Artificial intelligence and machine learning are making their ways rapidly to K-12 education. Google Teachable Machine, powered by convolutional neural networks, provides an easy-to-use yet powerful tool for classification tasks. We conducted a series of co-design workshops with primary school children, where they explored and designed their own machine learning powered applications with Google Teachable Machine. Our results show that Google Teachable Machine is a feasible tool for K-12 education. The trained machine learning models are lightweight and computationally efficient, and the applications are usable even with low-end mobile devices. The students and teachers appreciated the multidisciplinary and inclusive workshop, which supports development of transversal competencies in accordance to the national primary school curriculum.",2161-377X,978-1-7281-6090-0,10.1109/ICALT49669.2020.00099,,https://ieeexplore.ieee.org/stamp/stamp.jsp?arnumber=9156030,Machine Learning;K–12;Co-Design;Artificial Intelligence;Primary School;Neural Network;Computational Thinking,Conferences;Education;Google;Tools;Machine learning;Computational modeling,,39.0,,18.0,IEEE,4 Aug 2020,,,IEEE,IEEE Conferences,6,4
Model of Organizing Online Learning for Students in Agricultural Area,S. Ubaydullayeva; D. Ubaydullayeva; R. Gaziyeva; Z. Gulyamova; G. Tadjiyeva; N. Kadirova,"Department “Automation and control of technology process in production”, «Tashkent institute of irrigation and agricultural mechanization engineers» National Research University, Tashkent, Uzbekistan; Department “Automation and control of technology process in production”, «Tashkent institute of irrigation and agricultural mechanization engineers» National Research University, Bukhara, Uzbekistan; Department “Automation and control of technology process in production”, «Tashkent institute of irrigation and agricultural mechanization engineers» National Research University, Tashkent, Uzbekistan; Department of theory and methodology of teaching English language, Tashkent State Pedagogical University named after Nizami, Tashkent, Uzbekistan; Department of theory and methodology of teaching English language, Tashkent State Pedagogical University named after Nizami, Tashkent, Uzbekistan; Department of theory and methodology of teaching English language, Tashkent State Pedagogical University named after Nizami, Tashkent, Uzbekistan",2022 2nd International Conference on Technology Enhanced Learning in Higher Education (TELE),22 Jun 2022,2022,,,317,320,"Currently, Uzbekistan is rapidly implementing measures to develop digital technologies in all spheres of the economy, as well as to widely introduce information and communication technologies in public administration, education, healthcare and agriculture and other areas of public life. The country needs specialists with systems thinking, who can make informed decisions, who are able to think outside the box and modern, who are able to search for and use useful information, and learn innovative technologies. Internet technologies play an important role in solving these problems in the educational system. In particular, the implementation of priority projects has begun, which provide for the improvement of the e-government system, the development of the market for software products and information technologies, the organization of IT parks in all regions of the republic, and the provision of this area with qualified personnel. The article presents a model for organizing students’ independent work using online technologies. Detailed instructions are given for completing a specific task in computer science using an electronic educational resource developed by the authors of this article",,978-1-6654-7007-0,10.1109/TELE55498.2022.9800945,,https://ieeexplore.ieee.org/stamp/stamp.jsp?arnumber=9800945,model;informatization of education;means of information and telecommunication technologies;teaching electronic educational resources;online technologies,Computer science;Computational modeling;Education;Organizations;Medical services;Software;Systems thinking,,2.0,,16.0,IEEE,22 Jun 2022,,,IEEE,IEEE Conferences,6,10
