Development of Mobile Application for The Concept of Pattern Recognition in Computational Thinking for Mathematics Subject,A. H. Abdullah; M. A. Othman; N. Ismail; S. N. S. A. Rahman; M. Mokhtar; N. M. Zaid,"School of Education Faculty of Social Sciences and Humanities, Universiti Teknologi Malaysia, Johor Bahru, Malaysia; School of Education Faculty of Social Sciences & Humanities, Universiti Teknologi Malaysia; School of Education Faculty of Social Sciences & Humanities, Universiti Teknologi Malaysia; School of Education Faculty of Social Sciences and Humanities, Universiti Teknologi Malaysia, Johor Bahru, Malaysia; School of Education Faculty of Social Sciences & Humanities, Universiti Teknologi Malaysia; School of Education Faculty of Social Sciences & Humanities, Universiti Teknologi Malaysia","2019 IEEE International Conference on Engineering, Technology and Education (TALE)",15 Oct 2020,2019,,,1,9,"Computational thinking is one of the aspects emphasised in the Malaysian education system. However, the learning aids in the form of mobile applications that support computational thinking for mathematics are very limited in Malaysia. With that notion, this study aims to develop a mobile app for conceptual recognition pattern which is one of the skills in computational thinking for secondary school mathematics. The ADDIE model comprises of five phases which are analysis, design, development, implementation and evaluation are used as references for the development purpose. The earliest three phases of the ADDIE model focus on the aspect of application development. While the last two phases involve the aspects of appraisal from the applications which has been developed and it involved 23 mathematics teachers. Questionnaires with Likert Scale were used in the study as instruments to measure the five main aspects of the applications which are facilitation, usefulness, design, knowledge and suitability. The data was analysed using descriptive statistics based on frequency and percentage. The results of the analysis showed that the majority of respondents gave positive feedback on the five aspects measured in using the application. In conclusion, the mobile app of the pattern recognition concept for computational thinking skills for this mathematics subject has been agreed by the respondents to have good characteristics and brings great potential for the use by teachers and students in mathematics' classes.",2470-6698,978-1-7281-2665-4,10.1109/TALE48000.2019.9225910,,https://ieeexplore.ieee.org/stamp/stamp.jsp?arnumber=9225910,computational thinking;pattern recognition;mobile application;facilitation;usefulness;design;knowledge;suitability,Mobile applications;Pattern recognition;Education;Computational modeling;Social sciences;Mathematical model,,4.0,,32.0,IEEE,15 Oct 2020,,,IEEE,IEEE Conferences,6,6
Critical computational empowerment: Engaging youth as shapers of the digital future,M. Tissenbaum; J. Sheldon; L. Seop; C. H. Lee; N. Lao,"Massachusetts Institute of Technology, Cambridge, MA; Massachusetts Institute of Technology, Cambridge, MA; Youth Radio, Oakland, CA; St. Mary's College of California, Moraga, CA; Massachusetts Institute of Technology, Cambridge, MA",2017 IEEE Global Engineering Education Conference (EDUCON),8 Jun 2017,2017,,,1705,1708,"While there is growing recognition of the need to support young learners as they develop computational thinking (CT) skills, this paper advocates for an increased focus on computational identity (CI) and digital empowerment (DE) in particular, as we posit that these CT skills will help young learners become self-motivated, innovative creators. When nurturing identity and empowerment, it is a persistent challenge to provide youth with real-world experiences and suitable development tools. This paper advances two key approaches to address these issues: 1) A critical computational literacy approach to engage youth in developing personally meaningful applications that have impact in the real world; 2) the use of a tool, like MIT App Inventor, that lowers barriers to creating useful, impactful technology. Using two case-based studies, we show how these two approaches have supported youth in developing applications that respond to meaningful challenges in their communities and helped them to establish their computational identities and digital empowerment.",2165-9567,978-1-5090-5467-1,10.1109/EDUCON.2017.7943078,,https://ieeexplore.ieee.org/stamp/stamp.jsp?arnumber=7943078,computational thinking;digital empowerment;computational identity,Computer languages;Tools;Encoding;Context;Engineering education;Conferences,,17.0,,16.0,IEEE,8 Jun 2017,,,IEEE,IEEE Conferences,6,7
A Framework to Assess Melodic Effectiveness in Training Computational Thinking to Visually Impaired People,R. Costa; A. C. Neto; C. Araújo; P. R. Henriques,"ALGORITMI Research Centre/LASI, Univ. Minho, Braga, Portugal; Instituto Federal de Educação, Ciência e Tecnologia de São Paulo, Barretos, Brazil; ALGORITMI Research Centre/LASI, Univ. Minho, Braga, Portugal; ALGORITMI Research Centre/LASI, Univ. Minho, Braga, Portugal",2022 International Symposium on Computers in Education (SIIE),19 Dec 2022,2022,,,1,6,"Computational Thinking education and training are considered crucial activities to achieve success in later challenges like computer programming. To train the brain to think in logical terms it is necessary to use adequate resources. In this paper we address the difficult problem that is assessing efficacy of a given resource to the Computation Thinking development. To discuss that topic we will use the Melodic System which is a physical learning resource capable of constructing melodic sequences in a logical manner to be used by visually impaired people. Melodic was created aiming at training Computational Thinking through music and sounds and its impact in the learning process must be evaluated. This paper presents the tests and results applied to this intent, while also providing a general and summarized presentation of the Melodic System itself.",,978-1-6654-7464-1,10.1109/SIIE56031.2022.9982346,,https://ieeexplore.ieee.org/stamp/stamp.jsp?arnumber=9982346,Computational Thinking;Visually Impaired Students Education;Inclusive learning;Special Education;Music based Teaching;Assessment,Training;Shape;Music;Symbols;QR codes;Cognition;Computational efficiency,,,,7.0,IEEE,19 Dec 2022,,,IEEE,IEEE Conferences,6,7
Position: Building Blocks for Agent-based Modeling Can Scaffold Computational Thinking Engagement in STEM Classrooms,C. Bain; G. Anton; M. Horn; U. Wilensky,"Department of Computer Science & Department of Learning Sciences, Northwestern University, Evanston, IL, USA; Department of Computer Science & Department of Learning Sciences, Northwestern University, Evanston, IL, USA; Department of Computer Science & Department of Learning Sciences, Northwestern University, Evanston, IL, USA; Department of Computer Science & Department of Learning Sciences, Northwestern University, Evanston, IL, USA",2019 IEEE Blocks and Beyond Workshop (B&B),27 Dec 2019,2019,,,1,4,"Computational models and simulations can be powerful tools to help learners understand a wide variety of natural phenomena. However, understanding and learning from computational models requires learners to comprehend the rules agents follow that lead to emergent outcomes. Blocks-based programming is useful in scaffolding learners in the early stage of programming tasks. We posit that students can authentically interact with agent-based modeling via a blocks-based dialect of the popular ABM language NetLogo, dubbed NetTango, across many difficulty levels. Specifically, we discuss three different activities in which we have integrated blocks-based programming into STEM classrooms that show blocks can be used for activities of increasing computational engagement and difficulty.",,978-1-7281-4849-6,10.1109/BB48857.2019.8941204,,https://ieeexplore.ieee.org/stamp/stamp.jsp?arnumber=8941204,agent-based modeling;NetLogo;STEM education;blocks-based programming,Programming;Biological system modeling;Tools;Ecosystems;Agent-based modeling,,1.0,,29.0,IEEE,27 Dec 2019,,,IEEE,IEEE Conferences,6,4
Computational Thinking Skills for Today and Tomorrow’s Talent,H. Saleh,"Ministry of Communications and Information Technology, Chairwoman - Information Technology Institute, Egypt",2017 27th International Conference on Computer Theory and Applications (ICCTA),30 Jul 2021,2017,,,1,1,"Summary form only given, as follows. The complete presentation was not made available for publication as part of the conference proceedings. Computational thinking (CT) is a term invented by “J.M. Wing, 2006” to describe a set of thinking skills, behaviors, and approaches that are integral to solving complex challenges using a computer and widely applicable in the information society. CT is a must for today’s and tomorrow’s talent. The added-value of this early exposure to CT is that it will help juniors to shape a solid basis of algorithmic and data structures, which form the basic nuts and bolts of the mechanics of computer programming. The added value of developing professionals has its clear impact on the economy perspective, in light of the forecasted demand for today and tomorrow. (World economic forum, 2017) Computer programming is an outstanding way to develop computational thinking skills. It has been taken programming as a useful way for juniors to learn problem solving and computational thinking with an affirmative and quantifiable effect on juniors’ achievement, not only in areas such as math and science, but also in language skills, creativity, interpersonal skills and social emotional interaction.",,978-1-5386-3794-4,10.1109/ICCTA43079.2017.9497195,,https://ieeexplore.ieee.org/stamp/stamp.jsp?arnumber=9497195,,Programming profession;Buildings;Information and communication technology;Shape;Qualifications;Problem-solving;Government,,,,,IEEE,30 Jul 2021,,,IEEE,IEEE Conferences,6,7
Digital ink for cognitive assessment of computational thinking,A. P. Ambrósio; C. Xavier; F. Georges,"Institute of Informatics, Federal University of Goias, Goiania, GO, Brazil; Institute of Informatics, Federal University of Goias, Goiania, GO, Brazil; University Salgado de Oliveira, Goiania, GO, Brazil",2014 IEEE Frontiers in Education Conference (FIE) Proceedings,19 Feb 2015,2014,,,1,7,"Cognitive testing is concerned with quantitative and qualitative evaluation of an individual's intellectual functioning in its broad sense. Tests for evaluating cognitive components are based on submitting the subject to a given task and then assessing performance according to an established set of reference parameters. In order to analyze subject's behavior and test results, a software tool was developed based upon digital ink technology, which permits the digitalization of the assessment procedure, from the undertaking of the test to the production of the assessment results. By doing so, the test procedure is computerized and its data is saved in InkML format and processed to analyze tasks previously defined by the evaluator. We have used this tool to develop a Computational Thinking test defined within the Cattell-Horn-Carroll CHC framework of intelligence. Further investigating the relationship between fluid intelligence and computational thinking allows a better understanding of the main set of cognitive skills which need to be developed by students and professionals that aim to work in this domain. Moreover, it is suggested that assessments, independent of their context, may benefit from using the InkML tool, mainly due to the richer set of information that can be collected.",2377-634X,978-1-4799-3922-0,10.1109/FIE.2014.7044237,,https://ieeexplore.ieee.org/stamp/stamp.jsp?arnumber=7044237,computational thinking;digital ink;task analysis;tools;cognitive assessment,Ink;Programming profession;Cognition;Problem-solving;Educational institutions;Computers,,21.0,,29.0,IEEE,19 Feb 2015,,,IEEE,IEEE Conferences,6,8
Exploring the Potential of Modern Board Games to Support Computational Thinking,F. Machuqueiro; J. Piedade,"Institute of Education, University of Lisbon, Lisbon, Portugal; UIDEF, Institute of Education University of Lisbon, Lisbon, Portugal",2023 International Symposium on Computers in Education (SIIE),8 Feb 2024,2023,,,1,8,"The modern board game market (MBG) has been evolving gradually, and its mechanics appear to support concepts of Computational Thinking (CT). Seen as pedagogical resources applicable in the classroom context, this study analysed 10 MBGs with the aim of identifying aspects that can promote the development of CT, with a special focus on the modern board game 'Rossio.' Building upon the LM-TM model, an adapted version of the LM-GM model for board games, we propose a new framework that relates Computational Thinking learning mechanics (CTLM-TM) with tabletop game mechanisms.",2476-2172,979-8-3503-2931-5,10.1109/SIIE59826.2023.10423693,,https://ieeexplore.ieee.org/stamp/stamp.jsp?arnumber=10423693,Computational Thinking;Game Mechanics;Modern Board Games,Analytical models;Adaptation models;Systematics;Computational modeling;Games;Medical services;Context modeling,,,,38.0,IEEE,8 Feb 2024,,,IEEE,IEEE Conferences,6,8
Centering the Identities of Girls of Color in Computational Thinking Programs,P. Garcia; A. Jackson; L. -A. Jacobs,"School of Information, University of Michigan, Ann Arbor, USA; School of Education, University of Michigan, Ann Arbor, USA; School of Education, University of Michigan, Ann Arbor, USA","2020 Research on Equity and Sustained Participation in Engineering, Computing, and Technology (RESPECT)",4 Dec 2020,2020,1.0,,1,7,"Efforts to broaden participation in computing have revealed the need for a deeper theoretical and empirical understanding of how girls of color form computing identities. In this paper, we use the concept of identities-in-practice as an analytical frame to examine how girls of color engage in computational thinking practices. Our research investigates how the identities of girls of color can be leveraged as funds of knowledge in learning spaces and asks the following research question: How does centering the identities of girls of color impact their engagement with computational thinking practices? We provide a program overview of CompuGirls, describe our curricular design approach, and share results from pilot implementations of the program offered at public libraries in Michigan, Arizona, and California. Results from our pilot year demonstrate that integrating identity exploration into a computational thinking curriculum results in a mutually reinforcing relationship where girls of color experience reflective identity development while simultaneously increasing their understanding of computational thinking. We present our approach as a promising avenue for connecting computing knowledge and skills to girls' identities and lived experiences. By focusing on the girls' identities, the program re-imagines computational experiences by fostering interactions with computational thinking from a personal perspective. Ultimately, we argue that centering girls' identities should be viewed as an integral part of the learning process and not tangential.",,978-1-7281-7172-2,10.1109/RESPECT49803.2020.9272507,,https://ieeexplore.ieee.org/stamp/stamp.jsp?arnumber=9272507,computing education;computational thinking;gender,Libraries;Color;Cultural differences;Education;Programming profession;Image color analysis;Focusing,,1.0,,41.0,IEEE,4 Dec 2020,,,IEEE,IEEE Conferences,6,4
Embedding K12 Professional Development Through Co-Teaching Experiences-Sustaining Computational Thinking in Interdisciplinary Courses,S. Hug; S. Eyerman; R. Cota; E. Pontelli,"Colorado Evaluation & Research Consulting, Westminster, CO, USA; Colorado Evaluation & Research Consulting, Westminster, CO, USA; New Mexico State Univ., Las Cruces, New Mexico, USA; New Mexico State Univ., Las Cruces, New Mexico, USA","2018 Research on Equity and Sustained Participation in Engineering, Computing, and Technology (RESPECT)",14 Oct 2018,2018,,,1,6,"Focusing on interdisciplinary lesson development in K12 core courses has potential to broaden participation in computing by communicating computer science relevance to youth with limited computer science background within the courses they are already taking (e.g., high school chemistry). The DISSECT professional development program has demonstrated evidence of sustained effort beyond the years of the program—this case study was designed to understand factors that may have supported sustained use.",,978-1-5386-1363-4,10.1109/RESPECT.2018.8491708,,https://ieeexplore.ieee.org/stamp/stamp.jsp?arnumber=8491708,teacher professional development;sustained change;computational thinking,IEEE Fellows;Education;Computational modeling;Fingerprint recognition;Biological neural networks;Computer science;Task analysis,,2.0,,20.0,IEEE,14 Oct 2018,,,IEEE,IEEE Conferences,6,10
Cooperative Thinking: Analyzing a new framework for software engineering education (Extended abstract),P. Ciancarini; D. Russo; M. Missiroli,"Dept. of Computer Science, University of Bologna, Bologna, Italy; Dept. of Computer Science, University of Aalborg, Aalborg, Denmark; Dept. of Computer Science, University of Bologna, Bologna, Italy",2023 IEEE 35th International Conference on Software Engineering Education and Training (CSEE&T),31 Aug 2023,2023,,,121,121,"The paper we present [1] is an analysis of Cooperative Thinking, a model of team-based computational problem-solving that extends Computational Thinking with Agile Values.",2377-570X,979-8-3503-2202-6,10.1109/CSEET58097.2023.00025,,https://ieeexplore.ieee.org/stamp/stamp.jsp?arnumber=10229331,computational thinking;agile;teamwork,Analytical models;Computational modeling;Education;Problem-solving;Software engineering,,,,1.0,IEEE,31 Aug 2023,,,IEEE,IEEE Conferences,6,4
Mathematical modeling and development of variational thinking in engineering students,J. H. Núñez; A. M. Ecos Espino; A. R. Alvitez; M. A. Latorre Vilca,"Departamento Académico de Ciencias Básicas, Universidad Nacional Micaela Bastidas, Abancay, Perú; Escuela Profesional Ingeniería Ambiental, Universidad Nacional de Moquegua, Moquegua, Perú; Escuela Profesional Ingeniería Ambiental, Universidad Nacional José María Arguedas, Andahuaylas, Perú; Escuela Profesional Ingeniería Civil, Universidad Tecnológica de los Andes, Abancay, Perú",2021 International Symposium on Accreditation of Engineering and Computing Education (ICACIT),30 Nov 2021,2021,,,1,4,"The objective of the work was to evaluate the development of variational thinking after the application of a didactic strategy based on mathematical modeling, in civil engineering students from the Province of Abancay, in Peru. The sample was 111 students who worked in two experimental groups and in a control group. The evaluation of the development of variational thinking was carried out according to covariational reasoning. The results show that the application of the strategy allowed the development of variational thinking because it significantly improved the level of covariational reasoning, allowing students to develop and strengthen skills to coordinate the amount of change in the variables.",,978-1-6654-0719-9,10.1109/ICACIT53544.2021.9612461,,https://ieeexplore.ieee.org/stamp/stamp.jsp?arnumber=9612461,Mathematical modeling;variational thinking;covariational reasoning,Engineering profession;Computational modeling;Education;Mathematical models;Cognition;Accreditation;Problem-solving,,,,24.0,IEEE,30 Nov 2021,,,IEEE,IEEE Conferences,6,8
Injecting computational thinking into career explorations for middle school girls,H. C. Webb,"College of Information Sciences and Technology, Pennsylvania State University, State College, PA, USA",2011 IEEE Symposium on Visual Languages and Human-Centric Computing (VL/HCC),10 Nov 2011,2011,,,237,238,"Advances in technology are leading high schools to update computer science curricula; however there has been little analogous attention to technology-related education in middle schools. Middle school students are at a critical phase in life, when they are exploring more custom education options and starting to wonder “What do I want to be when I grow up?” My research is investigating whether and how computing skills can be integrated with career exploration to provide middle school girls a positive learning experience.",1943-6106,978-1-4577-1247-0,10.1109/VLHCC.2011.6070410,,https://ieeexplore.ieee.org/stamp/stamp.jsp?arnumber=6070410,middle school;Computational Thinking;career exploration,Educational institutions;Engineering profession;Computers;Programming;Conferences,,5.0,,6.0,IEEE,10 Nov 2011,,,IEEE,IEEE Conferences,6,10
Automated Feedback and Authentic Assessment for Online Computational Thinking Tutoring Systems,H. M. Jamil; X. Mou,"Department of Computer Science, University of Idaho, USA; Department of Computer Science, University of Idaho, USA",2022 International Conference on Advanced Learning Technologies (ICALT),17 Aug 2022,2022,,,53,55,"More than one third of computer science students either switch disciplines or fail the first programming class due to test/performance anxiety or learning difficulties. Personalized feedback can potentially improve both learning outcomes and retention for novice learners of computer programming. Online learning management and assessment systems have the power to allow self-paced, individualized and multi-layered learning that can be easily combined with time tested learning strategies such as pair programming, game based learning or visual programming to positively impact learning outcomes and support free-choice learning. In this paper, we introduce an online automated tutoring and assessment system, called MindReader, for introductory programming in C++. We discuss how MindReader generates personalized feedback fully automatically and prioritizes semantic error messages to avoid overwhelming the learner with a large number of signs of “failures.” We also discuss how MindReader can be used as a flexible teaching tool for introductory programming classes, and how its smart tutoring and assessment systems can improve learning.",2161-377X,978-1-6654-9519-6,10.1109/ICALT55010.2022.00024,,https://ieeexplore.ieee.org/stamp/stamp.jsp?arnumber=9853841,Novice programmer;block-text transition;learning environment;automated feedback;computational thinking,Visualization;Semantics;Education;Anxiety disorders;Switches;Games;C++ languages,,2.0,,14.0,IEEE,17 Aug 2022,,,IEEE,IEEE Conferences,6,10
The Role of Basic Psychological Needs Satisfaction in Primary Student’s Computational Thinking Development,S. X. Yin,"Wee Kim Wee School of Communication and Information, Nanyang Technological University, Singapore","2022 IEEE International Conference on Teaching, Assessment and Learning for Engineering (TALE)",14 Jun 2023,2022,,,799,801,"Large extant studies highlighted the importance of motivation in promoting students’ CT skills. However, few of them focused on basic psychological needs satisfaction (BPNS) and behavioral engagement. Since needs satisfaction could influence intrinsic motivation and lead to better performance. It is critical to understand whether, and to what extent, the learners’ CT skills are influenced by the level of BPNS. In light of this, the work-in-progress study employed a semester-long intervention to explore the role of BPNS in students’ CT skill development. A total of 600 primary students participated in this study. The findings of this study will contribute to a better understanding of primary students’ motivation in programming learning.",2470-6698,978-1-6654-9117-4,10.1109/TALE54877.2022.00147,,https://ieeexplore.ieee.org/stamp/stamp.jsp?arnumber=10148486,computational thinking;primary education;basic psychological needs satisfaction;motivation,Education;Psychology;Programming profession,,,,19.0,IEEE,14 Jun 2023,,,IEEE,IEEE Conferences,6,7
Parental Involvement in Computational Thinking Education: A Systematic Review,H. Cai; G. K. W. Wong,"Faculty of Education, The University of Hong Kong, China; Faculty of Education, The University of Hong Kong, China","2022 IEEE International Conference on Teaching, Assessment and Learning for Engineering (TALE)",14 Jun 2023,2022,,,572,579,"We conducted a systematic review of studies aimed at exploring the state of parental involvement in computational thinking (CT) education to facilitate students’ efficiency in learning computational thinking. In this review, we started with reviewing theories of parental involvement. Then we investigated and categorized types of parental involvement, parent roles, and parents’ psychological factors in the parenting process. We also supplemented a new involvement form in Level 2 of Hoover-Dempsey and Sandler’s Model of Parental Involvement in CT Education, namely parents’ support with concerns about using technology and CT tools. We proposed the Model of Parental Involvement in Computational Thinking Education. We conducted comprehensive research of related studies on parental involvement in CT education and identified the research gap in involving parents in children’s CT learning.",2470-6698,978-1-6654-9117-4,10.1109/TALE54877.2022.00100,,https://ieeexplore.ieee.org/stamp/stamp.jsp?arnumber=10148487,parental involvement (PI);computational thinking (CT);PI types;parent roles;psychological factors,Systematics;Computational modeling;Education;Psychology;Computational efficiency;Problem-solving;Programming profession,,1.0,,53.0,IEEE,14 Jun 2023,,,IEEE,IEEE Conferences,6,6
