Exploring the Balance Between Computational Thinking and Learning Motivation in Elementary Programming Education: An Empirical Study With Game-Based Learning,H. Liu; Z. Wu; Y. Lu; L. Zhu,"Shanghai University of Finance and Economics, Shanghai, China; Osaka University, Osaka, Japan; Chuo University, Tokyo, Japan; University of Minnesota, Minneapolis, MN, USA",IEEE Transactions on Games,17 Mar 2023,2023,15.0,1.0,95,107,"Computational thinking (CT) skills are generally regarded as a basic ability for problem-solving and are gradually filtering down to younger age groups. Existing research has attempted to increase interaction and enhance the learning interest of elementary school students through block-based programming environments represented by Scratch. However, criticism suggests that this approach has potential long-term constraints on CT education. Therefore, this study designed a game-based project to investigate students’ learning motivation and CT performance in different programming environments. A total of 108 fifth-grade students participated in the experiment and were divided into two experimental groups (EG1 and EG2) and a control group (CG). The students in experimental groups all undertook game-based learning, while EG1 students used C++ and EG2 students used Scratch; CG students used C++ for traditional algorithm-based learning. Findings suggest that traditional programming languages with game-based learning can also substantially improve learning interest, which can promote the efficiency of improving CT for students who already have some motivation and foundation for learning. But for students who still lack motivation, are also encouraged to develop an interest in a block-based programming environment. Teachers can choose the most appropriate approach for students to find the best balance between learning efficiency and long-term interest.",2475-1510,,10.1109/TG.2022.3143701,"Computer Center of the Children's Palace, China Welfare Institute; Osaka University Foundation for Future; ",https://ieeexplore.ieee.org/stamp/stamp.jsp?arnumber=9684681,Computational thinking (CT);elementary education;game-based learning;learning motivation;programming,Programming profession;Education;Programming environments;Games;Computer languages;C++ languages;Problem-solving,,7.0,,46.0,IEEE,18 Jan 2022,,,IEEE,IEEE Journals,8,6
"Fostering computational thinking in engineering education: Challenges, examples, and best practices",S. Gross; M. Kim; J. Schlosser; C. Mohtadi; D. Lluch; D. Schneider,"MathWorks GmbH, Ismaning, Germany; MathWorks GmbH, Ismaning, Germany; MathWorks GmbH, Ismaning, Germany; MathWorks Ltd., Cambridge, United Kingdom; Math Works, Inc., Natick, MA, USA; Institute of Imaging & Computer Vision, RWTH Aachen University, Aachen, Germany",2014 IEEE Global Engineering Education Conference (EDUCON),5 Jun 2014,2014,,,450,459,"Computational Thinking is a core capability for most engineers. The term summarizes a set of skills needed to transform real-life challenges into problems that can be solved with the help of a computer and to apply computer-based solutions to questions at hand. This mindset is fundamental to almost every engineering task. However, teaching Computational Thinking is a great challenge for educators worldwide. In designing and implementing university curricula, one has to take an increasing number of arguments into consideration. Technological progress requires the design, creation, and analysis of increasingly large and complex systems. Engineering working environments and tasks demand interdisciplinary teams and close communication between involved groups. In designing engineering curricula, these factors need to be considered and the necessary skills must be implicitly or explicitly developed. This paper highlights three examples of classes and projects aimed at enabling students to develop and increase Computational Thinking through systematic introduction of computational tools. From these successful case studies, the paper derives six best practices for fostering Computational Thinking in engineering education. A review of several examples is given, that are used to highlight and extract best practices. This provides a comprehensive overview of the relationships and simplifies the application of the aforementioned principles to course and curriculum designs.",2165-9567,978-1-4799-3191-0,10.1109/EDUCON.2014.6826132,,https://ieeexplore.ieee.org/stamp/stamp.jsp?arnumber=6826132,curriculum development;computational thinking;engineering skill set;education concepts specific for engineering education;industry and engineering education;integrated curriculum;education tools;project based learning,Engineering education;Computers;Educational institutions;MATLAB;Robot sensing systems;Hardware,,17.0,,33.0,IEEE,5 Jun 2014,,,IEEE,IEEE Conferences,8,8
A Strategy for the Development of Computational Thinking from Game Design Specifications,K. Tavares Fernandes; M. Lucena; E. Aranha,"Department of Informatics and Applied Mathematics, University Federal of Rio Grande do Norte - UFRN Natal, Brazil; Department of Informatics and Applied Mathematics, University Federal of Rio Grande do Norte - UFRN Natal, Brazil; Department of Informatics and Applied Mathematics, University Federal of Rio Grande do Norte - UFRN Natal, Brazil",2019 IEEE 19th International Conference on Advanced Learning Technologies (ICALT),2 Sep 2019,2019,2161-377X,,386,388,"Digital games are becoming more and more a part of our daily lives. After realizing this, several educators have been motivated to use games as teaching and learning tools. In this sense, it is possible to involve teachers and students in the production of their own games, thus contributing both to the development of computational thinking and to acquiring knowledge related to the different disciplines involved in this process. Despite the benefits, the production of games is a complex task that requires knowledge of a specific domain and presents a significant learning curve for students and teachers. The choice of using effective strategies such as Model-Driven Engineering (MDE) practices supported by a Controlled Natural Language (CNL) to promote the production of games in the educational context is decisive and can favor the adoption of game-based learning. This work proposes a strategy for the specification of game design for digital games by students and teachers in the classroom, that can promote the development of computational thinking, as well as reading and writing skills.",2161-377X,978-1-7281-3485-7,10.1109/ICALT.2019.00122,,https://ieeexplore.ieee.org/stamp/stamp.jsp?arnumber=8820846,digital games;game design;computacional thinking;learning,Games;Writing;Education;Production;Natural languages;Tools;Conferences,,,,18.0,IEEE,2 Sep 2019,,,IEEE,IEEE Conferences,8,7
Position: IntelliBlox: A Toolkit for Integrating Block-Based Programming into Game-Based Learning Environments,S. Taylor; W. Min; B. Mott; A. Emerson; A. Smith; E. Wiebe; J. Lester,"Dept. of Computer Science, North Carolina State University, Raleigh, NC, USA; Dept. of Computer Science, North Carolina State University, Raleigh, NC, USA; Dept. of Computer Science, North Carolina State University, Raleigh, NC, USA; Dept. of Computer Science, North Carolina State University, Raleigh, NC, USA; Dept. of Computer Science, North Carolina State University, Raleigh, NC, USA; Dept. of STEM Education, North Carolina State University, Raleigh, NC, USA; Dept. of Computer Science, North Carolina State University, Raleigh, NC, USA",2019 IEEE Blocks and Beyond Workshop (B&B),27 Dec 2019,2019,,,55,58,"Block-based programming languages reduce the need to learn low-level programming syntax while enabling novice learners to focus on computational thinking skills. Game-based learning environments have been shown to create effective and engaging learning experiences for students in a broad range of educational domains. The fusion of block-based programming with game-based learning offers significant potential to motivate learners to develop computational thinking skills. A key challenge educational game developers face in creating rich, interactive learning experiences that integrate computational thinking activities is the lack of an embeddable block-based programming toolkit. Current block-based programming languages, such as Blockly and Scratch, cannot be easily embedded into industry-standard 3D game engines. This paper presents IntelliBlox, a Blockly-inspired toolkit for the Unity cross-platform game engine that enables learners to create block-based programs within immersive game-based learning environments. Our experience using IntelliBlox suggests that it is an effective toolkit for integrating block-based programming challenges into game-based learning environments.",,978-1-7281-4849-6,10.1109/BB48857.2019.8941222,,https://ieeexplore.ieee.org/stamp/stamp.jsp?arnumber=8941222,block-based programming;game-based learning;K-12 computer science education;computational thinking,Games;Programming profession;Engines;Three-dimensional displays;Education,,7.0,,21.0,IEEE,27 Dec 2019,,,IEEE,IEEE Conferences,8,7
Computational Thinking: Learning by Doing with the Cinco Adventure Game Tool,F. Gossen; D. Kühn; T. Margaria; A. -L. Lamprecht,"Dept. of Computer Science and Information Systems, University of Limerick, Ireland; Dept. of Computer Science and Information Systems, University of Limerick, Ireland; Dept. of Computer Science and Information Systems, University of Limerick, Ireland; Dept. of Information and Computing Sciences, Utrecht University, Netherlands",2018 IEEE 42nd Annual Computer Software and Applications Conference (COMPSAC),22 Jun 2018,2018,1.0,,990,999,"Aspiring software developers, like the novice students in Computer Science courses, need to acquire a thorough understanding of fundamental computational concepts like sequential execution, conditional branching, loops, modularisation, hierarchy and reuse. This understanding and ""computational thinking"" is deepened when they encounter the concepts in different contexts and environments, as opposed to only in one traditional programming language. In this paper, we describe how we used the Cinco Adventure Game Tool, a tool that allows students to model simple browser games in an intuitive graphical framework, to train basic computational concepts in a creative and engaging, learning-by-doing fashion. On purpose, we steered away from traditional programming languages, in order to separate the use of the concepts and constructs from the hurdle of a programming language syntax and development environment. The experiences with a large group of first-term Computer Science students in two successive years were very positive: The students had no problems in understanding and using the concepts, used the tool proficiently and enjoyed designing and modelling the games. Working together on a game project in small groups, they showed sustained engagement, developed a high level of confidence, and created quite complex games containing various fundamental computational constructs.",0730-3157,978-1-5386-2667-2,10.1109/COMPSAC.2018.00175,,https://ieeexplore.ieee.org/stamp/stamp.jsp?arnumber=8377800,"Computer science education, Computational thinking, Model-driven development",Games;Tools;Education;Unified modeling language;Computational modeling;Software,,14.0,,37.0,IEEE,22 Jun 2018,,,IEEE,IEEE Conferences,8,7
Innovative Approach to Enhancing STEM Skills through Educational Games: Work in Progress,M. H. Dlab; B. Crnković; I. Traunkar; V. M. Crnković,"Faculty of Informatics and Digital Technologies, University of Rijeka, Rijeka, Croatia; Faculty of Mathematics, University of Rijeka, Rijeka, Croatia; Faculty of Mathematics, University of Rijeka, Rijeka, Croatia; Faculty of Mathematics, University of Rijeka, Rijeka, Croatia",2024 IEEE Frontiers in Education Conference (FIE),26 Feb 2025,2024,,,1,5,"This innovative practice paper describes a work in progress on creating and applying educational games that develop mathematical and computational thinking within the project Science&Math educational games from preschool to university - SciMaG. Using educational games, especially in STEM fields, is an effective way to engage students and promote key skills across different age groups and environments. Such activities promote problem solving, logical thinking, strategic planning, and other important skills and can be used with students of different age groups in the classroom, in extracurricular activities, or at home. STEM science outreach activities organized as part of science festivals and similar events can be an excellent opportunity for a game-based approach. However, organizing events for large numbers of participants can pose a logistical challenge in terms of volunteer availability. This paper presents the results of a study in which game-based activities to develop mathematical and computational thinking were integrated into a science outreach event for primary school students on the occasion of Pi-Day. The innovative aspect of the approach is reflected in the use of a combination of games (commercial, newly developed games, and games inspired by commercial ones) which have an interesting math basis and require mathematical or computational thinking skills as well as in the introduction of peer teaching through attracting high-school students as volunteers for the organized event. In the evaluation of the approach, the perceptions of the primary school students (Ns=295), their teachers (NT=19), and the high-school students participating as volunteers in the organized event (Nv=11) were examined using a questionnaire-based study. All groups of participants responded positively and confirmed educational potential of the games. Results confirmed that the activities were well-received and that such events have the potential to enhance learning experiences in STEM. The results also provide valuable insights and motivation for further development of educational games within the SciMaG project.",2377-634X,979-8-3503-5150-7,10.1109/FIE61694.2024.10893066,,https://ieeexplore.ieee.org/stamp/stamp.jsp?arnumber=10893066,STEM;games;computational thinking;science outreach;SciMaG project,Educational robots;Education;Games;Strategic planning;Teamwork;Problem-solving;STEM,,,,40.0,IEEE,26 Feb 2025,,,IEEE,IEEE Conferences,8,7
Computer programming as an educational tool in the English classroom a preliminary study,J. Moreno-León; G. Robles,"Programamos.es Sevilla, Spain; GSyC/LibreSoft, Universidad Rey Juan Carlos Madrid, Spain",2015 IEEE Global Engineering Education Conference (EDUCON),30 Apr 2015,2015,,,961,966,"Computational thinking, a problem solving method that uses computer science techniques, has recently become mainstream as many governments and major Internet companies are promoting programming skills among children. However, little is known about how programming affects other aspects of life beyond the acquired programming skills. In this regard, this paper summarizes the work done in the school San Diego and San Vicente (Madrid, Spain) during the third quarter of the year 2013/2014, where we conducted a study with four groups of students in 4th and 5th grade to measure to what extent the use of computer programming in English classes can be an interesting educational tool with a positive impact on the learning otucome of the students. The results show that the groups working with programming activities improved more than the groups using traditional resources. Moreover, when asked via surveys at the end of the study, most students felt that coding was a positive influence, not only for learning English, but for developing other important skills as teamwork and learning to learn.",2165-9567,978-1-4799-1908-6,10.1109/EDUCON.2015.7096089,,https://ieeexplore.ieee.org/stamp/stamp.jsp?arnumber=7096089,computer programming;coding;English;educational tool;computational thinking;technology-enhanced learning,Programming profession;Computers;Europe;Encoding;Education;Conferences,,12.0,,16.0,IEEE,30 Apr 2015,,,IEEE,IEEE Conferences,8,9
Analyzing the Learning Process in Online Educational Game Design: A Case Study,N. Ahmadi; M. Jazayeri,"Faculty of Informatics, University of Lugano, Lugano, Switzerland; Faculty of Informatics, University of Lugano, Lugano, Switzerland",2014 23rd Australian Software Engineering Conference,5 Jun 2014,2014,,,84,93,"Educational game design environments are used for teaching computational thinking and software engineering concepts to novices. In software engineering education, there has recently been calls for ""innovative methods for software teaching and training in online courses"" (http://2014.icse-conferences.org/seet). However, to date, learning these concepts is tied to a formal learning environment and the presence of a teacher. In line with the new educational opportunities provided by the Web such as massive open online courses (MOOCs) and e-learning 2.0 platforms, we have created an online educational game design environment with integrated learning resources including video tutorials, showcases, and communication tools. To understand the effect of online educational game design environments with integrated support for learning on novices' use of the system and their learning, we conducted a mixed-method study with nine participants. While the learning goals were achieved to a high degree, the analysis of participants' interaction with the system reveals interesting phenomena about user preferences, such as the fact that during the given computational thinking tasks, the participants preferred the synchronous communication channel to other forms of commonly provided learning resources such as forums.",2377-5408,978-1-4799-3149-1,10.1109/ASWEC.2014.34,,https://ieeexplore.ieee.org/stamp/stamp.jsp?arnumber=6824112,computer science education;computational thinking;educational game design;end-user programming;cyberlearning;MOOC;learning analytics,Games;Software engineering;Programming profession;Education;Software;Communities,,3.0,,29.0,IEEE,5 Jun 2014,,,IEEE,IEEE Conferences,8,7
Data Mining Framework to Analyze the Evolution of Computational Thinking Skills in Game Building Workshops,A. A. de Souza; T. S. Barcelos; R. Munoz; R. Villarroel; L. A. Silva,"Laboratório de Computação Aplicada–LABCOM3, Instituto Federal de Educação, Ciência e Tecnologia de São Paulo, Guarulhos, Brazil; Laboratório de Computação Aplicada–LABCOM3, Instituto Federal de Educação, Ciência e Tecnologia de São Paulo, Guarulhos, Brazil; Centro de Investigación y Desarrollo en Ingeniería en Salud, Universidad de Valparaíso, Valparaíso, Chile; Escuela de Ingeniería Informática, Pontificia Universidad Católica de Valparaíso, Valparaíso, Chile; Programa de Pós-Graduação em Engenharia Elétrica e Computação, Universidade Presbiteriana Mackenzie, Campinas, Brazil",IEEE Access,18 Jul 2019,2019,7.0,,82848,82866,"Computational thinking has become a required capability in the student learning process, and digital games as a teaching approach have presented promising educational results in the development of this competence. However, properly evaluating the effectiveness and, consequently, student progress in a course using games is still a challenge. One of the most widely implemented ways of evaluation is with an automated analysis of the code developed in the classes during the construction of digital games. Nevertheless, this topic has not yet been explored in aspects such as incremental learning, the model and teaching environment and the influences of acquiring skills and competencies of computational thinking. Motivated by this knowledge gap, this paper introduces a framework proposal to analyze the evolution of computational thinking skills in digital games classes. The framework is based on a data mining technique that aims to facilitate the discovery process of the patterns and behaviors that lead to the acquisition of computational thinking skills, by analyzing clusters with an unsupervised neural network of self-organizing maps (SOM) for this purpose. The framework is composed of a collection of processes and practices structured in data collection, data preprocessing, data analysis, and data visualization. A case study, using Scratch, was executed to validate this approach. The results point to the viability of the framework, highlighting the use of the visual exploratory data analysis, through the SOM maps, as an efficient tool to observe the acquisition of computational thinking skills by the student in an incremental course.",2169-3536,,10.1109/ACCESS.2019.2924343,"Pós-Graduação de Instituiçães de Ensino Particulares da Coordenação de Aperfeiçoamento de Pessoal de Nível Superior (CAPES-PROSUP), Brazil; Corporación de Fomento de la Producción (CORFO) 14ENI2-26905 “Nueva Ingeniería para el 203”—Pontificia Universidad Católica de Valparaíso, Chile; ",https://ieeexplore.ieee.org/stamp/stamp.jsp?arnumber=8743397,Analytical models;computer science education;data mining;data models;education;games;self-organizing feature maps,Games;Data mining;Education;Self-organizing feature maps;Conferences;Computer science,,20.0,,47.0,CCBY,21 Jun 2019,,,IEEE,IEEE Journals,8,7
Integrating computational thinking into english dialogue learning through graphical programming tool,X. Weng; G. K. W. Wong,"Faculty of Education, The University of Hong Kong, Hong Kong; University of Hong Kong, Hong Kong, HK","2017 IEEE 6th International Conference on Teaching, Assessment, and Learning for Engineering (TALE)",11 Jan 2018,2017,,,320,325,"Developing students' Computational Thinking (CT), which is an essential problem-solving skill for people living in the 21st century, becomes an outstanding purpose of promoting engineering education in K-12 classrooms. In this paper, CT is represented through the graphical programming language Scratch according to the three-dimensional CT framework proposed by Brennan and Resnick [1]. This project aims to explore the classroom effect of using graphical programming tool in learning English dialogue and investigate how to improve the integration of CT into English education with the elements of programming. To achieve these objectives, a qualitative method was adopted to collect data through class observations, programming projects, and semi-structured interviews. Nine primary students (n = 9) were the targeted participants, who attended extra-curricular lessons for computer programming using Scratch at their school in Hong Kong. The preliminary results show that the introduction of CT into English dialogue learning through graphical programming language can motivate primary school students to study English dialogue. To better connect CT with English education via graphical programming tools, students and the teacher in the group under study suggested making computers interact with people autonomically, designing games in graphical programming environments to encourage English learning, keeping the balance of students' graphical programming language learning skill and their English language skill, and adopting graphical programming language as a tool to finish the summative English language assignments.",2470-6698,978-1-5386-0900-2,10.1109/TALE.2017.8252356,,https://ieeexplore.ieee.org/stamp/stamp.jsp?arnumber=8252356,Computational Thinking;English dialogue learning;Graphical programming language;Classroom effect,Education;Tools;Programming profession;Computer languages;Interviews;Writing,,9.0,,19.0,IEEE,11 Jan 2018,,,IEEE,IEEE Conferences,8,7
Identifying Preliminary Design Principles for a Robotics-based Learning Environment,K. Tengler; O. Kastner-Hauler; B. Sabitzer,"Department of Media Pedagogy, University of Teacher Education Lower Austria, Baden, Austria; Department of Media Pedagogy, University of Teacher Education Lower Austria, Baden, Austria; Department of STEM Education, Johannes Kepler University Linz, Linz, Austria",2021 16th International Conference on Computer Science & Education (ICCSE),21 Oct 2021,2021,,,771,776,"In recent years, the interest in introducing programming activities into the classroom has increased, emphasizing the importance of promoting computational thinking in young learners. Robotics-based learning environments are intended to facilitate the learning of programming at the primary level and support developing skills such as collaboration, creativity, and problem-solving thinking in a cross-curricular approach. An Austrian research project focuses on developing and implementing a robotics-based learning environment using the educational design research approach to gain insights into the introduction of computational thinking in primary education. This paper reports on a study to identify preliminary design principles of the learning environment that form the basis of the prototyping cycle of the overall research. Data were collected by interviewing seven experts who have theoretical and practical expertise on educational robotics in primary education. The resulting six preliminary design principles describe the first insight into the design of robotics-based learning environments.",2473-9464,978-1-6654-1468-5,10.1109/ICCSE51940.2021.9569250,,https://ieeexplore.ieee.org/stamp/stamp.jsp?arnumber=9569250,design principles;computational thinking;educational robotics;primary school,Education;Collaboration;Problem-solving;Robots;Programming profession;Creativity,,1.0,,43.0,IEEE,21 Oct 2021,,,IEEE,IEEE Conferences,8,7
