Developing Future Computational Thinking in Foundational CS Education: A Case Study From a Liberal Education University in India,B. Kalluri; P. Prasad; P. Sharma; D. Chippa,"School of Computing and Data Sciences, FLAME University, Pune, India; School of Computing and Data Sciences, FLAME University, Pune, India; School of Computing and Data Sciences, FLAME University, Pune, India; School of Computing and Data Sciences, FLAME University, Pune, India",IEEE Transactions on Education,20 Dec 2024,2024,67.0,6.0,944,953,"Contribution: This article proposes a new theoretical model with a goal to develop future human computational thinking (CT) in foundational computer science (CS) education. The model blends six critical types of thinking, i.e., logical thinking, systems thinking, sustainable thinking, strategic thinking, creative thinking, and responsible thinking into the design of a first-year undergraduate programming course. The study describes a creative blended pedagogy that embeds the proposed model into the course plan.Background: The emergence of artificial intelligent systems such as large language models from a knowledge provider perspective, coupled with a gradual change in post-pandemic outlook of education challenge the relevance and raises concerns about the future of education. The 21st-century human CT requirements, viz., learning to code (skill) and thinking computationally (competency), will be inadequate in the future. Moreover, there is substantial evidence which shows that most introductory programming courses fail to integrate critical elements like ethics and responsibility as part of the course.Intended Outcomes: The authors anticipate experiential learning models such as this has immense potential to future-proof CS education, as well as make future software engineers responsible citizens.Application Design: The proposed model blends six types of thinking into the design and activities of the course. The underlying theoretical basis of these activities revolve around three key principles: 1) experiential learning; 2) self-reflection; and 3) peer learning.Findings: This case study from a liberal educational institution in India qualitatively shows evidence of students developing six critical elements of thinking that shapes their future CT ability.",1557-9638,,10.1109/TE.2024.3394060,seed fund given to Kalluri’s Urban Design and Open-innovation Studio at FLAME University; ,https://ieeexplore.ieee.org/stamp/stamp.jsp?arnumber=10530940,21st-century skills;computer science (CS);creative pedagogy;foundational education;future thinking,Education;Sustainable development;Computational modeling;Systems thinking;Programming profession;Software systems;Green products,,,,35.0,IEEE,15 May 2024,,,IEEE,IEEE Journals,8,8
The Research of Programming Teaching in Primary School on the Cultivation of Computational Thinking,Y. Wang; Y. Zhang; A. Mao; J. Wang; N. Li,"School of Educational Information Technology, Central China Normal University, Wuhan, China; School of Educational Information Technology, Central China Normal University, Wuhan, China; Primary School Affiliated to University of Science and Technology, Wuhan, China; Teacher Education College, Huzhou University, Huzhou, China; School of Educational Information Technology, Central China Normal University, Wuhan, China",2020 Ninth International Conference of Educational Innovation through Technology (EITT),19 Jan 2021,2020,,,250,255,"With the development of digital technologies, teaching computational thinking and relative skills in the K-12 curriculum can benefit students in thinking and create in the digital area. This study designed a programming course to help students develop computational thinking and relative skills, and conducted a practice in a primary school. Results indicated that students were benefited from three stages of the teaching process. Students' computational thinking knowledge, programming knowledge and skills, and problem-solving were developed after the learning of a semester. The programming works of the students also revealed that there was a tendency in the development of creativity.",2166-0549,978-1-7281-9171-3,10.1109/EITT50754.2020.00051,,https://ieeexplore.ieee.org/stamp/stamp.jsp?arnumber=9320732,computational thinking;programming course design;K-12 curriculum,Programming profession;Problem-solving;Testing;Media;Debugging;Visualization;Task analysis,,1.0,,11.0,IEEE,19 Jan 2021,,,IEEE,IEEE Conferences,8,6
An Empirical Study on the Effect of Gamified Teaching in Scratch Courses on Developing Elementary Students' Computational Thinking,Y. Chen; Y. Zhao; M. Wang,"School of Information, Yunnan Normal university, Kunming, China; School of Information, Yunnan Normal university, Kunming, China; School of Information, Yunnan Normal university, Kunming, China",2024 13th International Conference on Educational and Information Technology (ICEIT),5 Jun 2024,2024,,,78,83,"Computational thinking is a crucial skill for students to analyze and solve problems, and programming education serves as an important pathway to cultivate computational thinking. This study combines relevant literature and utilizes Scratch, a visual programming software, to construct a gamified teaching model for Scratch courses. A quasi-experimental research design was employed, involving two fifth-grade classes from a primary school in K city. The study employed methods such as analysis of student works, SPSS scale data analysis, and student interviews to investigate the impact of gamified teaching in Scratch courses on developing elementary students' computational thinking. The results indicate that gamified teaching in Scratch courses significantly enhances the computational thinking level of elementary students, particularly in the dimensions of critical thinking, problem-solving ability, and algorithmic thinking. Based on the research findings, it is recommended that gamified teaching in Scratch courses should involve appropriate teaching tools, incorporate game-based learning, emphasize problem-solving, encourage collaborative learning, and provide training for educators competent in programming education.",,979-8-3503-7266-3,10.1109/ICEIT61397.2024.10541025,,https://ieeexplore.ieee.org/stamp/stamp.jsp?arnumber=10541025,scratch;gamification;elementary students;computational thinking;empirical study,Training;Visualization;Federated learning;Education;Urban areas;Software;Problem-solving,,1.0,,12.0,IEEE,5 Jun 2024,,,IEEE,IEEE Conferences,8,6
Design and Effectiveness Analysis of Interactive Strategies for Teaching Graphical Programming Oriented to Cultivate Computational Thinking,F. Wang; L. Chen; W. Wang,"Department of Information Science and Technology, Northeast Normal University, Changchun, China; Department of Information Science and Technology, Northeast Normal University, Changchun, China; Department of Information Science and Technology, Northeast Normal University, Changchun, China",2023 5th International Conference on Computer Science and Technologies in Education (CSTE),29 Sep 2023,2023,,,10,14,"Computational thinking is the third major mode of thinking in the age of artificial intelligence. Many primary and secondary schools adopt graphical programming as an important way for students' computational thinking development. However, elementary school students have less self-control in learning and are more dependent on teachers, so timely and effective teaching interaction is an important guarantee for the realization of the teaching goals of graphical programming. Through three rounds of action research, the essay investigated the impact of teaching interaction strategies on the development of students' computational thinking. The findings show that students are satisfied with the designed interaction strategies, and the interaction strategies can significantly improve students' computational thinking ability and level.",,979-8-3503-2572-0,10.1109/CSTE59648.2023.00009,,https://ieeexplore.ieee.org/stamp/stamp.jsp?arnumber=10261600,computational thinking;computer-assisted learning;graphical programing;teaching interaction,Education;Artificial intelligence;Programming profession,,,,14.0,IEEE,29 Sep 2023,,,IEEE,IEEE Conferences,8,6
Study on Teaching Programming in Adult Colleges Based on the Cultivation of Computational Thinking,J. Chen,"Jingan Branch Campus ShangHai Open University, Shanghai, China",2023 5th International Conference on Computer Science and Technologies in Education (CSTE),29 Sep 2023,2023,,,81,85,"Computational thinking is an important concept that is currently receiving widespread attention in the international computing community. Teaching programming is an effective way to develop students' computational thinking. Students in adult colleges and universities face the pressure of study and work, and there is a need to improve their computational thinking skills. In this paper, we design and develop a set of programming activities based on computational thinking development for adult college students, and study the changes in students' computational thinking before and after they participate in the activities. It provides a reference for frontline teachers and related researchers to design programming activities and conduct research in computational thinking.",,979-8-3503-2572-0,10.1109/CSTE59648.2023.00021,,https://ieeexplore.ieee.org/stamp/stamp.jsp?arnumber=10261627,computational thinking;programming;activity design,Education;Programming profession;Faces,,,,10.0,IEEE,29 Sep 2023,,,IEEE,IEEE Conferences,8,6
Exploring the Impact of the Learning Sequence of Computational Thinking and Programming on Learning Outcomes,C. -H. Lai; C. -H. Hsieh,"Department of Information and Computer Engineering, Chung Yuan Christian University, Taoyuan, Taiwan; Department of Information and Computer Engineering, Chung Yuan Christian University, Taoyuan, Taiwan",2023 IEEE 3rd International Conference on Social Sciences and Intelligence Management (SSIM),22 Mar 2024,2023,,,175,179,"The primary objective of this research was to investigate effective learning sequences starting with computational thinking, programming, or both. We experimented with and analyzed the learning sequence of students from the Department of Computer Engineering, Information Management, and Mechanical Engineering. The findings indicated that the students of the Department of Computer Engineering possessed prior experiences in programming or computational thinking. Their learning sequences limitedly impacted learning outcomes. Conversely, for the students of the Department of Information Management, learning computational thinking before programming did not result in better learning outcomes, emphasizing the need for coherence in courses. The students of the Department of Mechanical Engineering showed the practical value of computational thinking in non-IT disciplines, particularly in using specialized software such as MATLAB. For students with foundational knowledge, the learning sequence between learning computational thinking and programming was less significant. However, for beginners or those from non-IT backgrounds, effective learning required the coherence and integration of courses. Thus, it is required to maintain cross-course coherence and establish links between computational thinking and programming skills to offer a more in-depth learning experience.",,979-8-3503-2778-6,10.1109/SSIM59263.2023.10469197,,https://ieeexplore.ieee.org/stamp/stamp.jsp?arnumber=10469197,computational thinking;programming;learning sequence;course coherence;interdisciplinary application,Training;Systematics;Social sciences;Coherence;Programming;Software;Information management,,,,11.0,IEEE,22 Mar 2024,,,IEEE,IEEE Conferences,8,8
Research on Developing Computational Thinking of Middle School Students Based on Gamified Text Programming Teaching Activities,J. Liu; Y. Bai; X. Xia,"Key Laboratory of Child Development and Learning Science, Ministry of Education, Southeast University, Nanjing, China; Key Laboratory of Child Development and Learning Science, Ministry of Education, Southeast University, Nanjing, China; Key Laboratory of Child Development and Learning Science, Ministry of Education, Southeast University, Nanjing, China",2023 5th International Conference on Computer Science and Technologies in Education (CSTE),29 Sep 2023,2023,,,175,179,"With the coming of the digital intelligence era, contemporary middle school students should have the key literacy and ability to quickly adapt to the current social development. Computational thinking, as a critical problem-solving skill in the era of artificial intelligence, has also become a basic literacy for students to face the future. However, the traditional “duck and filler” teaching mode is ineffective in developing computational thinking skills, while the gamified learning approach allows learners to interact with games in an immersive way. Therefore, this study combines games and programming teaching, builds a teaching model of gamified text programming, and develops a series of programming courses. It can develop not only computational thinking skills and improve students' programming ability but also effectively avoid the limitations of traditional programming teaching.",,979-8-3503-2572-0,10.1109/CSTE59648.2023.00037,,https://ieeexplore.ieee.org/stamp/stamp.jsp?arnumber=10261572,computational thinking;gamified teaching;text programming;teaching model,Codes;Computational modeling;Education;Games;Digital intelligence;Problem-solving;Artificial intelligence,,1.0,,22.0,IEEE,29 Sep 2023,,,IEEE,IEEE Conferences,8,6
Design Thinking in App Inventor Game Design and Development: A Case Study,P. Chen; R. Huang,"Smart Learning Institute, Beijing Normal University, Beijing, China; Department of Educational Technology, Capital Normal University, Beijing, China",2017 IEEE 17th International Conference on Advanced Learning Technologies (ICALT),7 Aug 2017,2017,,,139,141,"Design thinking is considered as a creative, humancentred, participative, exploratory and problem-solving process that values different perspectives of a problem. In this study, we bring the design thinking in a curriculum framework of K-12 game creation by App Inventor which is currently popular block based programming environments for fostering Computational Thinking. In a case study on a middle-school students game creation course in Beijing, the students' creative thinking process and computational thinking skill are investigated in order to understand perceptions of App Inventor and physics cognitive knowledge involved in the game creation. The future work is to construct a framework of integrating the Design Thinking for cultivating K-12 students' computational thinking.",2161-377X,978-1-5386-3870-5,10.1109/ICALT.2017.161,,https://ieeexplore.ieee.org/stamp/stamp.jsp?arnumber=8001741,Design Thinking;App Inventor;Game Creation;Computational Thinking,Games;Programming profession;Computer science education;Physics;Conferences,,9.0,,32.0,IEEE,7 Aug 2017,,,IEEE,IEEE Conferences,8,6
Teaching Reform of Software Engineering Course Based on Computational Thinking,X. Dong; J. Jia,"Special Education College Beijing Union University, Beijing, China; Special Education College Beijing Union University, Beijing, China",2020 International Conference on Artificial Intelligence and Computer Engineering (ICAICE),1 Mar 2021,2020,,,399,402,"For students majored in computer science, the ability to have computational thinking is an essential skill. Facilitating computational thinking cannot only help students understand the professional knowledge and principles of computer, but also bring new ideas to addressing complex problems, therefore, many colleges and universities have carried out computer professional curriculum reform based on computational thinking. Due to the high degree of abstraction of computational thinking, traditional teaching methods will cause students to understand computational thinking only at the conceptual level, and cannot realize the flexible use of computational thinking concepts. This study takes the software engineering course as an example to explain how to integrate the concepts of computational thinking into the original courses. The goal is to enable students to understand software engineering contents problems from the perspective of problem-solving.",,978-1-7281-9146-1,10.1109/ICAICE51518.2020.00084,Beijing Union University; ,https://ieeexplore.ieee.org/stamp/stamp.jsp?arnumber=9361128,Computational Thinking;Problem Solving;Software Engineering;Teaching Reform,Computer science;Software design;Education;Software;Problem-solving;Artificial intelligence;Software engineering,,1.0,,8.0,IEEE,1 Mar 2021,,,IEEE,IEEE Conferences,8,5
Automated Feedback in Software Engineering: Enhancing Computational Thinking Process,F. Parsa; A. A. A. Moghadam; T. Ashuri,"Department of Computer and Software Engineering, Faculty of Artificial Inteligence, Karaj Azad University, Karaj, Iran; Department of Robotics and Mechatronics Engineering, Southern Polytechnic College of Engineering and Engineering Technology, Kennesaw State University, Marietta, GA, USA; Southern Polytechnic College of Engineering and Engineering Technology, Kennesaw State University, Marietta, GA, USA",SoutheastCon 2024,24 Apr 2024,2024,,,1621,1626,"Computational thinking is the systematic approach of defining a problem and crafting its solution. It employs computer programming algorithms to address scientific, engineering, and mathematical challenges using programming languages. Feedback plays a pivotal role in the learning journey of computational thinking. It is widely recognized that offering timely feedback to students on their computational endeavors significantly contributes to their achievement and overall satisfaction with the course. This research explores the implementation of an automated feedback system designed to evaluate and offer early feedback on computer engineering projects. The aim is to integrate best practices and software tools related to computational thinking into the thinking and learning processes within an engineering curriculum. Preliminary findings suggest that the automated feedback system enhances students' computational skills and improves their performance in the course. We anticipate that the insights gained from this research will inform the enhancement of curricula and course evaluations across different computational thinking tasks, disciplines, and courses.",1558-058X,979-8-3503-1710-7,10.1109/SoutheastCon52093.2024.10500041,,https://ieeexplore.ieee.org/stamp/stamp.jsp?arnumber=10500041,Software Engineering;Computational Thinking;Automated Feedback System;Computer Programming,Computer languages;Systematics;Programming;Task analysis;Software tools;Best practices;Software engineering,,,,15.0,IEEE,24 Apr 2024,,,IEEE,IEEE Conferences,8,8
Impact of Teaching Approaches to Computational Thinking on High School Students: A Systematic Mapping,L. Ribeiro Silva; A. Pedro da Silva; A. Toda; S. Isotani,"Universidade de Sao Paulo, Sao Paulo, SÃ£o Paulo, BR; University of São Paulo (ICMC-USP), São Carlos, SP, Brazil; University of São Paulo (ICMC-USP), São Carlos, SP, Brazil; Univ. of Sao Paulo, Sao Carlos, Brazil",2018 IEEE 18th International Conference on Advanced Learning Technologies (ICALT),13 Aug 2018,2018,,,285,289,"The role of computing in society is fundamental for the political, economic and cultural development of countries, especially in a globalized context. Computational thinking is an extremely important skill in the education of young students, since the ability of intuitively abstracting information and knowledge promotes an expansion of the learning dimension. This study aims to gather approaches used for teaching computational thinking exclusively to high school students, highlighting their performance and motivation resulting from the applications of such approaches. In order to answer our research question, a systematic mapping of the analysis of 15 studies was conducted. The use of computer programming proved to be the most used way to disseminate computational thinking. The students who participated in approaches regarding the insertion of computational thinking in the classroom showed positive impact on the development of classroom activities, as well as motivation to learn.",2161-377X,978-1-5386-6049-2,10.1109/ICALT.2018.00072,,https://ieeexplore.ieee.org/stamp/stamp.jsp?arnumber=8433517,Computational Thinking;Approach;K-12,Education;Systematics;Programming profession;Databases;Tools;Robots,,5.0,,25.0,IEEE,13 Aug 2018,,,IEEE,IEEE Conferences,8,9
Students’ Engagement in Computational Thinking Skills Using A Game Based-Learning,R. D. Handayani; S. B. Prastowo; Jamalludin; Triyanto; M. A. Thohir,"Physics Education Department, University of Jember, Jember, Indonesia; Physics Education Department, University of Jember, Jember, Indonesia; Magister of Science Education, University of Jember, Jember, Indonesia; Civics Education Department, Sebelas Maret University, Surakarta, Indonesia; Faculty of Education Universitas Negeri Malang, Malang, Indonesia",2023 9th International Conference on Education and Technology (ICET),19 Feb 2024,2023,,,148,151,"This study aims to investigate students’ engagement in computational thinking skills through game-based learning in science classrooms. Data was gathered through observation and interviews with 30 secondary school students. Research data were analyzed qualitatively through six stages involving preparing and organizing data, exploring data, developing descriptions, representing results, interpreting findings, and validating the accuracy of findings. The study results show that game-based learning makes students engaged in computational thinking skills. Interaction with educational games trains students to find solutions more precisely and bravely in making decisions. Game-based learning can be a solution to introduce students’ computational thinking skills in a more enjoyable way. Teachers are expected to use this research to teach students computational thinking skills through game-based learning.",2770-4807,979-8-3503-5829-2,10.1109/ICET59790.2023.10435201,,https://ieeexplore.ieee.org/stamp/stamp.jsp?arnumber=10435201,computational thinking;game-based learning;student engagement,Education;Atmosphere;Games;Interviews,,1.0,,28.0,IEEE,19 Feb 2024,,,IEEE,IEEE Conferences,8,6
A Design and Development of Internet of Things (IoT) System and Learning Activity to Promote Computational Thinking,S. Sonsilphong; A. Sonsilphong; D. Hormdee; P. Sae-Joo,"Academic Affairs, Faculty of Medicine, Khon Kaen University, Khon Kaen, Thailand; Department of Electrical Engineering, Rajamangala University of Technology, Khon Kean, Thailand; Department of Computer Engineering, Faculty of Engineering, Khon Kaen University, Khon Kaen, Thailand; Computer Education Program, Faculty of Education, Khon Kaen University, KhonKaen, Thailand",2022 7th International STEM Education Conference (iSTEM-Ed),25 Oct 2022,2022,,,1,4,"Computational Thinking (CT), problem-solving and programming skills are important for the students with major of computer education of higher levels education which related to the computing science contents. The instructions must provide the basic contents and learning activities, including Internet of Things (IoT), big-data and programming, as well as Artificial Intelligence (AI) and machine learning. However, these courses present learning difficulties based upon the students' individual skills. Development and integration of the IoT system would offer supporting tools for learning activities and improve the students' computational thinking, problem-solving, and programming skills. This paper presents the design and development of IoT system to support students' computational thinking, problem-solving, and programming skills training through block-based programming and integrated platforms. The IoT system comprises three layers (hardware, middleware, and applications), using existing platforms and devices as well as newly developed. To validate the viability of the proposed pipelined realization, the developed systems were implemented for higher education level students of computer education program. The students' computational-thinking, problem-solving, and programming skills were significantly improved through the proposed learning system throughout the course.",,978-1-6654-9821-0,10.1109/iSTEM-Ed55321.2022.9920899,,https://ieeexplore.ieee.org/stamp/stamp.jsp?arnumber=9920899,computing skills;computational thinking;problem solving;Internet of Things;computer programming,Training;Learning systems;Education;Machine learning;Learning (artificial intelligence);Hardware;Internet of Things,,1.0,,8.0,IEEE,25 Oct 2022,,,IEEE,IEEE Conferences,8,9
